selftext,title,dem
[removed],freedom is a slippery slope!,0
,"i've got to keep posting this from trump's snapchat, it's the funniest thing i've seen in a while.",0
,remember kids. reacting to blatant racism is outrageous according to cnn.,0
,we must not forget what freedoms were lost just north of us.,0
,study: a majority of the population may have 'some degree' of preexisting immunity to covid-19,0
,perry introduces legislation supporting hong kong’s democracy and freedom,0
,not even surprised...,0
,blind singer dedicates song to preborn children: ‘you’re welcome on earth’,0
,sorry y'all...,0
,follow the science...,0
,you won’t see this on cnn,0
,pro-abortion group wants fda to ‘seize website domains’ promoting abortion pill reversal,0
,they loved it until it affected them negatively,0
,"obama’s political police: liars, leakers and lawyers",0
[removed],biden and the breakfast club vs. trump's birtherism,0
,ted cruz rips apart hollywood celebrities submitting to china censorhsip!,0
,he’s all they have left,0
,"president trump: if abortion businesses can be called ‘essential,’ so can houses of worship",0
,melania trumps the obamas. democrats still can’t stand that their successors outshine them.,0
"i’m starting to think the democrats sincerely think trump is racist and that racism is so rampant in america that you have to be white to best donald trump. they nominated the most boring white dude ever to run against them thinking it’s about racism and not values. idk, maybe i’m crazy, but what the hell were they thinking nominating biden?",joe biden theory.,0
,"where is cuomo’s apology for killing 10,000 people? no ifs, no ands, no buts — just a tearful mea culpa from the nursing home killer.",0
,the cdc just gave us the biggest reason to end the coronavirus lockdowns,0
,"can we sue our way out of quarantine? the longer the lockdowns last and the less necessary that they seem, the more scrutiny courts will apply.",0
,"still more evidence that lockdowns were a massive waste of time, money, and lives",0
,the italian connection: why did the u.s. ambassador to italy and his deputy request unmaskings of flynn calls?,0
,michael flynn was not masked because the fbi framed him as a clandestine agent of russia,0
,lee smith: how russiagate began with obama’s iran deal domestic spying campaign,0
i can't even have an adult conversation with her about anything she doesn't agree with.she actually praised joe biden by his comment and said he should say that for mexicans wtf. she will get mad if i disagree about with basketball player is the goat and tells me to stfu because i don't think jordan is the best. hates trump while knowing nothing about how he helped blacks.,my mom has been brainwashed for being black.,0
,"mcenany schools reporters on 'good journalism', provides suggested questions on 'unmaskings'",0
,modern republicans,0
,racist or...,0
,fr. frank pavone: texts from norma mccorvey disprove ‘aka jane roe’ filmmakers’ claims,0
[removed],trump approval poll for covid-19 (help needed),0
,"when a democrat says a racist remark, its ""clearly a joke."" i can't wait for november to see them lose again!",0
,"""hey lejardin"" | bigg jah",0
,cnn's new coronavirus town hall was set to be more grim news,0
,this has to be the stupidest headline i’ve ever seen...,0
,joe biden does a meme on the breakfast club,0
[removed],wow not one negative thing today on biden!,0
,sowell: 'friends' of blacks,0
,i think this picture is going to be important in this election cycle. people show us part of what happened never what happened.,0
[removed],i must ask,0
,biden’s mental frailty makes him a teflon candidate,0
,lockdowns are as contagious as covid,0
,"a little gem meme, great for the kids that like touching leg hair, joe biden ""you aint black"" coffin",0
,pro-life activist assaulted outside new mexico’s late-term abortion business,0
,bet founder robert johnson: joe biden 'should spend the rest of his campaign apologizing to every black person he meets',0
,the unknown healthcare law that made lockdowns inevitable: ‘certificates of need.’,0
,a tale of two states — new york and florida. which today can only mean the tale of two very different governors.,0
,obamagate: of course it comes back to obama’s narcissism - how the obama administration stole the trump presidency,0
,never forget: hilary losing a rigged debate against donald trump,0
,rep. swalwell takes on acting dni richard grenell; gets crushed like a bug,0
,awful mitt romney joins with democrats to support mail-in voting,0
,"biden: 'if you don't let me sniff your hair, you ain't a woman'",0
,medical professionals recount stories of babies born alive during abortions,0
,"oh, is this one of those “acceptable” forms of racism?",0
,quid pro joe at it again,0
,survey on varying political parties and standpoint on the environmental worldview (americans 18+),0
,tim scott responds to biden's 'you ain't black' comment,0
,i made joe a campaign poster!,0
[removed],discussion: what's the best and worst decision donald trump and barack obama have each made in office?,0
,‘aka jane roe’ producers have strong pro-abortion bias… and one of them is tied to kamala harris,0
,omar-in trump's america i feel unsafe when practicing my religion,0
,survey on varying political parties and standpoint on the environmental worldview (americans 18+),0
[removed],joe biden blast charlemagne: you ain't black if you consider voting trump- black communities respond,0
[removed],joe biden blast charlemagne: you ain't black if you consider voting trump- black communities respond,0
[removed],joe biden blast charlemagne: you ain't black if you consider voting trump- black communities respond,0
,come on. biden’s ‘you ain’t black’ comment was clearly a joke. (that is the actual headline),0
[deleted],"if the president decided to make this kind of “joke”, he’d immediately be crucified.",0
,"nope, there’s no reason to believe that the suburbs are a lost cause for the gop.",0
[removed],illegal worker gathering spots. zero enforcement of covid-19 guidlines by nova police.,0
,model from missouri with down syndrome won’t ‘let her disability define her’,0
,more voting red flags as batch of south carolina ballots turn up... in maryland!,0
,desantis and florida emerge as trump showcase for reopening,0
,"kayleigh mcenany shuts down reporter: ""boy it's interesting to be in a room that desperately wants to seem to see these houses of worship &amp; churches stay closed.""",0
,"trump announces that houses of worship are ‘essential,’ calls on governors to open them up",0
,"shock: documents from new mexico facility reveal dozens of late-term, healthy babies aborted daily",0
,"the stay at home orders are doing more harm than good, these corrupt facist governers like jay inslee are trying to push policy during this that has already been voted down multiple times. it's absolutely discusting, they are ignoring the doctors, police, and economist advice. lawsuits should happen",0
,watch live: president trump demands governors reopen country’s houses of worship,0
,"biden says black voters considering trump over him ""ain't black""",0
,conservative gays represent!!,0
,"""if you have a problem figuring out whether you're for me or trump, then you ain't black"" - biden to black radio host",0
,how obama weaponized surveillance laws to target trump,0
,don’t fall for biden’s misdirections about not hiking your taxes,0
,don’t fall for biden’s misdirections about not hiking your taxes,0
[removed],2024 opinions,0
,"joe biden: ‘if you have a problem figuring out whether you’re for me or trump, then you ain’t black’",0
,biotech firm: screening to ‘avoid’ babies with down syndrome is a ‘cash cow’,0
,"joe biden: ‘if you have a problem figuring out whether you’re for me or trump, then you ain’t black’",0
,joe biden: vote for me or you’re racist.,0
,joe biden’s handlers are now having to interject during his interviews,0
,"biden tells charlamagne tha god, who is black, “i tell you if you have a problem figuring out whether you’re for me or trump, then you ain’t black” (17:25 or so)",0
,the railroading of michael flynn,0
,"joe biden's mind melts, says 'you ain't black' if you are an african-american who doesn't vote for him",0
,"cuomo, de blasio blame ignorance, but not themselves, in wake of damning report",0
,"trump spotted wearing mask during tour, but refuses to wear it in front of press",0
,"biden: 'if you have a problem figuring out whether you're for me or trump, then you ain't black'",0
,china v. trump: covid and the 2020 election,0
,finally! amy klobuchar admits miracle drug hydroxychloroquine saved her husband's life (video),0
,who believes the lockdowns were about science?,0
,joe biden shames black people if they won't vote for him,0
,the obamagate scandal just got even dirtier,0
,divided by covid-19: democratic u.s. areas hit three times as hard as republican ones,0
,https://news.yahoo.com/divided-covid-19-democratic-u-100249199.html,0
,covid-19 fear used to justify expanded government power,0
,new york governor cuomo shifts blame for covid-19 nursing home patient deaths,0
,"keeping america skeered - that’s what the democrats want, from now until election day.",0
,when all you have to do is do nothing. its over boys,0
,dershowitz doubles down: state can force vaccination if it's 'safe',0
,house dem criticizes her own party for shoving 'wish list' stimulus package: 'it's not a good look',0
,florida ruled to be in violation of science for not having more people die,0
,detroit police make arrest after horrifying video emerges of elderly man beaten at nursing home. governor gretchen whitmer silent.,0
,stacey abrams says she will step down as governor if asked to run for vp,0
,"no matter who biden picks, his running mate will be a ‘karen’",0
,"mayor was out partying during lockdown. when cops showed up, he hopped in a coffin and pretended to be dead.",0
,"georgia governor announces fewer than 1,000 hospitalized with coronavirus",0
,"wapo writer, harvard scientist explain the real reason republicans want to reopen for business",0
,"stacey abrams lashes out at 'white voting base,' laments illegal aliens ""are no longer able to elect anyone who represents them"" (video)",0
,‘china won’: tucker carlson details ‘uncomfortable facts’ about coronavirus response,0
,"guns, corrupt public defenders, and corrupt psychiatrist",0
[removed],follow me on instagram @1776.memes,0
,"her children went to foster care because of her addiction, but two years later they were reunited",0
,"senate confirms pro-qanon john ratcliffe as director of national intelligence, buckle up!",0
,“president” plump!!!,0
,"south philly judge of elections pleads guilty to stuffing ballot boxes, accepting bribes",0
,"but obeying the who is the responsible choice, right?",0
,ron desantis blasting media on state response coverage,0
,"united states coronavirus: 1,620,902 cases and 96,354 deaths",0
,pres trump just outfoxed schumer and pelosi in his reply to flag-lowering letter,0
,"how fear, groupthink drove unnecessary global lockdowns",0
[removed],question looking for information/research,0
,california doctors say they've seen more deaths from suicide than coronavirus since lockdowns,0
,what we can learn from coronavirus per capita death rates,0
,"amy ""karen"" klobuchar finally admits hydroxychloroquine saved her husband's life!",0
,end new york city’s lockdown now!,0
,china’s great civilisation is now ‘in the hands of thugs and gangsters’,0
[removed],new member,0
,philadelphia dem elections judge admits taking bribes to inflate vote counts,0
,south philly judge of elections admits he took bribes to stuff the ballot box for democratic candidates,0
[removed],storm,0
,"colorado citizens need 10,000 more signatures for chance to end late-term abortion in state",0
,appeals court orders judge in flynn case to explain actions in dismissal,0
,worth remembering?,0
are the democrats really going to put forth deteriorating joe biden as he diminishes before our eyes. i can’t see him surviving the convention. i thought the idea was to have an electable alternative to trump? biden is clearly not that person. it makes me wonder what the dems have up their sleeve,dem candidate,0
,watch: parents of of girl with brain abnormality say they’re ‘so happy’ she’s their daughter,0
[removed],aoc reparation payments for slavery,0
,senators send letter to doj urging investigation into planned parenthood for fraud,0
,the science of reopening,0
,"if trump loses in 2020, he’ll be the nominee again in 2024",0
,new york state's grim reaper...,0
,"the susan rice cya memo, unredacted",0
,this is why i'm a republican,0
,elise stefanik shuts down gov. cuomo's pathetic attempt to blame trump for ny nursing home crisis,0
,finally revealed: the whereabouts of kim jong un!,0
,muh freedom,0
,kayleigh mcenany grills reporters on zero coverage of susan rice email!,0
,democratic party official admits to stuffing ballot boxes in philadelphia elections,0
[removed],color scheme opinion for firearm owners,0
,"joe biden pushed max baucus for ambassador to china, he's now playing the role of chinese agent",0
[removed],what are examples of andrew yang being a generally uncharismatic candidate?,0
,broken elevator at dangerous illinois abortion center forces emts to carry injured woman down stairs,0
,how democrats are trying to use heroes act to buy young americans’ votes,0
,"92% of left-wing activists live with their parents, berlin study finds",0
,schiff still insists he has 'significant evidence' against trump,0
,major election update could change everything 🚨🚨,0
,"you okay, fredo? mcenany slams cuomo, lefty journalists bashing hydroxychloroquine",0
,nets skip bipartisan calls to probe why gov. cuomo put covid in nursing homes,0
,"cuomo thumbs nose at accountability for gov. brother, plays with giant swabs",0
,gov. cuomo blames trump for new york's thousands of nursing home deaths,0
,"‘bet you stay home now hypokrits’: church that refused to close during lockdown gets burned down, investigated as arson",0
,pennsylvania: case study in exploiting a crisis,0
,vice president alert – she says 'yes' 🚨🚨,0
,two new house members sign petition for born-alive abortion survivors protection act,0
,"for liberal elite, ignorance is strategy - but what will happen when biden emerges from his basement?",0
,the telephone bill comes for sundown joe - new reasons to suspect joe biden will not make it to the nomination finish line.,0
,an aristocracy of losers - how do the media choose the democratic party’s “rising stars”?,0
[removed],why is everyone against the lockdown?,0
,aoc-led push to kill amazon's nyc move under renewed scrutiny as city faces catastrophic job losses,0
,cnn praises governor cuomo for killing off the elderly since they probably would have voted for trump,0
,"as mask use rises dramatically, evidence for their effectiveness is 'sparse and contested'",0
,nbc never had a problem with hillary clinton's pay-to-play state department but with mike pompeo different rules apply,0
,"venezuela, for a season - in a free economy, there is uncertain prosperity; in a socialist economy, there is certain misery. that’s the choice.",0
,there’s no political bias on reddit.....,0
,a growing american divide between red &amp; blue states,0
,in elon we trust,0
,"state police in democratic state: we will not arrest, jail any individual for violating lockdown orders",0
,donald trump races to rescue us economy before 2020 elections,0
,white paper on defunding npr/pbs (excellent overview),0
,senate passes bill that could delist chinese companies from u.s. stock exchanges,0
"looking for a book that gives a true accurate telling of his presidency...not a puff piece that he almost always gets, stating how “amazing” he was. policies, events, all of it! thank you!!",book of an accurate retelling of obama presidency?,0
,senate committee authorizes subpoena in hunter biden-burisma investigation,0
,doctors raise alarm about health effects of continued coronavirus shutdown,0
,"white house new press secretary kayleigh mcenany blasts chris cuomo, gives reason why trump uses hydroxychloroquine",0
,just like 2016,0
,recording of calls between joe biden and ex-ukraine president poroshenko leaked | new york post,0
[removed],i wonder what mr. biden can say about his conversations with ukraine...,0
,battered california republicans see hope after special election victory,0
,trump is winning his standoff with the press,0
,is he right or wrong?,0
,online events,0
,deaths vs. economic pain: cable news' imbalanced picture,0
[removed],we need to raise are energy !,0
,out like flynn: how the media embraced prosecutorial misconduct as an article of faith,0
,dnc chair perez: trump's vote-by-mail opposition a 'desperate effort to steal an election',0
,virginia governor spent 65 days on taxpayer-funded jaunts to his nc beach home since start of 2019,0
,"the media trashed gov. ron desantis over fired florida data scientist, the real story leaves egg on their face",0
,stacey abrams likes identity politics like a fat kid likes cake,0
,what do you make of chris and andrew cuomo roasting each other on cnn tonight?,0
,democrat kamala harris introduces resolution that promotes chinese communist propaganda talking point about coronavirus,0
,"michigan illegally mailed 7.7 million absentee ballots, in case you were wondering why blue states are still pushing lockdowns…this is not about a virus… this is about trump.",0
,i don't get how that wasn't the largest story of the month. pure corruption.,0
,michelle caruso-cabrera: aoc's challenger who used to live in trump hotel and called for privatising medicare and social security,0
,aoc rival michelle caruso-cabrera’s book pushed gop-friendly policies,0
,"why california is in trouble – 340,000 public employees with $100,000+ paychecks cost taxpayers $45 billion",0
[removed],is reddit anti-trump and in bed with dems to interfere with the upcoming election?,0
,got banned from r/black people twitter for saying this. looks like they can’t handle the truth.,0
,got banned from r/black people twitter for saying this. guess they can’t handle the truth,0
,it’s almost like patriotism is not xenophobia,0
,the real issue with roe: abortion is a deliberate act of violence against innocent human beings,0
,what “open” used to mean – inbetween rags and riches,0
,‘aka jane roe’: norma mccorvey’s longtime friends set the record straight,0
,the public (domain) is an ass,0
,beastmode: pompeo says he doesn't need ethics guidance from menendez,0
,give florida and ron desantis credit where it's due,0
,amateurs,0
,pelosi passes shocking radical bill - 14 dems vote against it 🚨🚨,0
,bioethicist: covid-19 nursing home crisis is a symbol of our throwaway culture,0
,trump becomes addicted to hydroxychloroquine [oc] [parody],0
[removed],come november,0
,democrat governors warn if lockdowns are lifted they won't get nearly as much time in the spotlight,0
,"before november, america must know more about trump-russia probe",0
,"proxy voting lets '20 people control' congress, warns kevin mccarthy",0
,if only people realized,0
,even shitliberalssay has been taken over by leftist.,0
,aoc rival michelle caruso-cabrera’s book pushed gop-friendly policies,0
,where does ron desantis go to get his apology? the florida covid-19 strategy that has gotten bad press and favorable results.,0
,non essential spending it's time to end the shutdown. people have to work spending frivolously money will run out.,0
,i miss reagan,0
,thought this was hilarious.,0
,"biden claims trump should enact a program he's already enacted, his flub highlights how trump is helping americans",0
,voter fraud?,0
,woman injured at florida planned parenthood amidst covid-19 crisis,0
,yup,0
,no swimming! de blasio says people who go to nyc beaches can't get in the water or 'they'll be taken right out' as memorial day weekend nears,0
,senate’s top democrat is resigning - republicans make their move 🚨,0
,"column: feminist hypocrisy is a fact, not a 'right-wing trap'",0
,"msnbc: 9-minute cuomo interview, only 9-second ask on nursing homes",0
,a free press can't expect a free lunch,0
,"andrew mccarthy: rice tried to protect obama, blame comey for withholding intelligence from flynn &amp; trump team",0
,a new cold war has begun: calling china to account for covid-19 plague is just a start,0
,wow! an englishman supports gun rights,0
,a new cold war has begun: calling china to account for covid-19 plague is just a start,0
[removed],republicans don’t know what they’re talking about.,0
,government tells planned parenthood to return $80 million in covid-19 funds,0
,"biden says trump using hydroxychloroquine is like injecting 'clorox into your blood ... come on, man!'",0
,stanford study suggests coronavirus might not be as deadly as flu,0
,dear gop: stop cowering before bad-faith race card attacks,0
,what u.s. national strategy should look like in the wake of coronavirus,0
,"ohio gov. mike dewine sets the example for a smart, efficient reopening",0
,andrew klavan: media are ‘corrupt system - like chicago democrats',0
,public policy rhetoric: politicians pretend there are no choices and no trade-offs,0
,coronavirus crisis: ron desantis got florida’s covid-19 strategy right,0
,whitmer reveals she had an 'opening conversation' about biden vp potential,0
,covid-19 and the obedience experiment. » the daily,0
,declassified email shows comey raised concerns over sharing 'sensitive' information with flynn,0
,#andrewcuomoisaliar,0
,andrew cuomo denies his order killed thousands of nursing home residents: “we didn’t lose anyone”,0
[removed],i hope everyone is doing good throughout these times! i hope that we can soon reopen in a few months.,0
,"apparently i don’t understand the importance of a child’s life due to wanting guns to be legal, yet she does understand the importance of a child’s life?",0
,we cannot return to campus this fall,0
,our covid future: the establishment strikes back,0
,the hunting of the president - scores of bad actors first want to take out the attorney general.,0
,why can we find this on r/politics,0
,had this happen,0
,tommorow: protestors hold national day of mourning over covid republican response,0
,"great read, extremely insightful. sometimes it’s difficult to see the ugliness inside of oneself but it’s essential for growth nevertheless. -to foreigners do we all look like american idiots?",0
,"great read, very insightful",0
,ukraine judge orders joe biden be listed as alleged perpetrator of crime in prosecutor’s firing,0
,democrat kids raised by karen!!!,0
,trump administration to end national guard covid deployments one day before gi bill benefits kick in,0
,ya don't say?,0
,‘life is sacred’: christian evangelist and apologist ravi zacharias dies at 74,0
,pa governor wolf keeping us closed,0
,joe rogan taking jre to spotify exclusively for $100m,0
,"greta thunberg may be cnn's favorite fake microbiologist, but i know who my favorite fake biologist is...",0
,the aclu's absurd title ix lawsuit,0
[removed],watch this video...,0
,team biden panics as leaked ukraine phone calls may require appointment of a special counsel,0
,gowdy: members of trump's family were unmasked on inauguration day,0
,bernie is inspired by his supporters,0
,elon is the chosen one! he will bring balance to the nation!,0
,biden phone call with poroshenko,0
,planned parenthood spends $5 million to decry covid-19’s impact on abortion ‘access’,0
[removed],whats the deal with stacey abrams?,0
,"unlike the democrats, trump is not willing to sit around and wait",0
[removed],just got banned from r/conservative and i'm a republican. what happend?,0
,"hey guys, dem here, but i come in peace. i know that a lot of you guys are really smart, but i feel like this is why a lot of liberals think all trump supporters are stupid. i’d love to hear your thoughts? jordan klepper vs. trump supporters.",0
,hell yeah !,0
,pelosi swears in two new gop members of congress,0
,"ain’t we ‘deplorables’ deplorable? sure are, to centralizers who call themselves progressives in their intensified war on federalism.",0
,time to cut off saudi arabia - maybe moneybags bin salman will learn some financial lessons from the coronavirus crisis.,0
,"tucker carlson: americans are rebelling against neurotic, dumb leaders and extreme coronavirus lockdowns",0
,'trump smash!' roars giant green president after taking one too many doses of hydroxychloroquine,0
[deleted],made this my flag in animal crossing and i thought i should post it here,0
,"i made a video comparing america then and america now, i hope you enjoy!",0
[deleted],column: i’ve gotten hate mail my whole career. but i’m shocked by the anti-semitic rants from trump supporters lately,0
,trey gowdy drops a bombshell: obama admin also unmasked president trump's family,0
,kidney disease kept her from becoming pregnant – until her father saved her life,0
,fox news meteorologist unloads on cuomo following mother and father-in-law deaths at nursing homes,0
,"phone calls between biden and ukraine's poroshenko leaked; details $1 billion ""quid pro quo"" to fire burisma prosecutor",0
,how the pro-life movement continues to help women and children during covid-19,0
,house democrats say trump-russia obstruction investigation 'ongoing' - could result in new articles of impeachment!,0
,california city declares itself 'sanctuary city' from gov. newsom's strict lockdown order,0
,"vote blue, patrick would too!",0
,a backlash is coming for democrats blocking re-opening,0
,what is the conservative response to this ghastly disrespect to the victims of 9/11?,0
