selftext,title,dem
,even my phone news board is trying to tell me who i should like,0
,ann coulter turns on president trump,0
,two-pound preemie born at 26 weeks during pandemic graduates from nicu,0
,because that makes sense,0
[removed],are there any based news websites worth following ?,0
[removed],news sites,0
,hundreds of doctors sign letter urging trump to lift the lockdown before it causes more deaths,0
,new reality show has men competing to ‘mate’ and create a baby with one woman,0
,is the tweet real?,0
,ancestry.com revokes genealogies of african americans who don't support biden,0
,biden reelected trump last friday - the former vp’s patronizing remark was no jest and it was fatal to his campaign.,0
,a growing tide among democrats against klobuchar as vp,0
,"watchdog asks feds to investigate university, biden center for millions in anonymous china donations",0
,trump must name special counsel on obamagate,0
,a short guide to justifying re-lockdown or why the media is so desperate to turn good covd-19 news into bad,0
,a ‘deplorables’ moment for joe biden shows why he won’t win the black vote,0
,vice president mike pence: this memorial day our freedoms are cherished even more. here's why,0
,trump aims to cut red tape tying up doctors,0
,"sleepless and sea-addled: thanks to california's closure, last month saw a year's worth of suicides",0
,pentagon rips nyt's memorial day editorial accusing military of celebrating white supremacism,0
,"the china question - in matters of trade and manufacturing, the united states has not been the naive victim of cunning chinese masterminds. we asked for this.",0
,did donald trump just save the world?!,0
,california democrats fight to restore racial preferences,0
,memorial day is a national thanksgiving,0
,free virtual unexplained infertility summit will present ‘restorative options to conceive naturally’,0
,why china’s move to rein in hong kong is just the start,0
,god it’s good to be a republican,0
,justin haskins: biden's socialists — look who the so-called moderate has added to his campaign,0
,pelosi’s private call about trump leaks!! look what she said....,0
,make ‘babe’ the new ‘karen’! it’s unisex and non-partisan... anyone can be babe if you think they’re a pig herding sheep!,0
,‘babe’ should be the new ‘karen’... it’s non-partisan and unisex. anyone can be babe if you think they’re a pig trying to herd sheep!,0
,guess y’all aren’t black anymore,0
,this is who y’all support,0
,new york times on memorial day weekend: 'why does the u.s. military celebrate white supremacy?',0
,"the 2020 election? a referendum — on progressivism. not on trump, but on the actual source of what ails our way of government.",0
[removed],i'm tired of the democrats and their identity politics and all of them trying to speak for me,0
[removed],i just have to get this off my chest,0
[removed],r/politics shitshow,0
,why joe biden can do no wrong,0
[removed],i'm tired of the democrats and their identity politics and all of them speaking for me.,0
,paying illegal immigrants puts america last,0
[removed],i'm black and i'm tired of the democrats and their identity politics and all of them speaking for me.,0
,"the herd immunity taboo - purity and danger: why some are strangely comforted by lockdowns, fearful of herd immunity, and quick to punish anyone who questions the stark choice between them",0
,"this article is so funny to me, do they even know what they're talking about?",0
,it’s actually really entertaining to see democrats fight with each other,0
,sad,0
,republicans sue to stop newsom from sending mail-in ballots to all california voters,0
,a compilation i made,0
,trump’s narrow comeback hope: make america free again,0
,"gop groups sue california gov. newsom, claim vote-by-mail order is ""brazen power grab""",0
,corrupt democrat arrested by fbi – faces 10 years in prison,0
,supreme court judge orders president trump to testify 😏😏,0
,this could not be any more true,0
,the economic devastation wrought by the pandemic could ultimately kill more people than the virus itself - if only the democrats has heeded this when the president said it over a month ago.,0
,"cnn downplays biden's 'you ain't black' comments, avoids on-air coverage throughout the day",0
,#youaintblack remix (featuring johnny cash),0
,we need to speak honestly about the gop’s evolution into a conspiracy cult,0
,democrats begin excuses for prolonging november election,0
,man at abortion business allegedly pulls gun on sidewalk counselors,0
[removed],censorship,0
[removed],hello guys can someone know a subreddit or website or social media account that have anti atheism memes or jokes for trolling athiest,0
,reasons to vote blue,0
,pompeo delivers powerful statement against ccp on virus and their new move to kill hong kong's indepedence,0
,adorable: photo of politician dad holding baby during zoom meeting goes viral,0
,🚨🚨 top conservative in bad accident!!,0
,yoda on the corona virus,0
[removed],introduce me to the american politics.,0
,cruz and crenshaw fire back after o'rourke scoffs at gov. abbott tweet about reopening texas,0
,the media finally figures out how to (safely) dismiss tara reade,0
"- what do democrats call a black man or woman who leaves the democratic party and votes republican?

not black.

self-hating &lt;slur&gt;.

oreo.

uncle tom / aunt jemima.

- what do democrats call a hispanic man or woman who leaves the democratic party and votes republican?

self-hating &lt;slur&gt;.

race-traitor.

white.

- what do democrats call a jewish man or woman who leaves the democratic party and votes republican?

self-hating &lt;slur&gt;.

- what do democrats call someone who is gay or transgender who leaves the democratic party and votes republican?

gender traitor.

self-hating &lt;slur&gt;.

- what do democrats call a woman who leaves the democratic party and votes republican?

gender traitor.

self-hating &lt;slur&gt;.

- what do **republicans** call someone of any of the above groups who leaves the republican party and votes democrat?

democrat.",what do democrats call someone who leaves the democratic party to become a republican?,0
[removed],banned from r/democrats???,0
,top trump ally quits... says she’s ‘done’ with ‘loser’ trump 😳😳,0
,"sarena just graduated high school, but has been denied lifesaving transplant due to disabilities",0
[removed],serious question?,0
,i live in virginia. ralph northam visited va beach yesterday and ignored his own rules about social distancing and wearing a mask. he’s also considering making masks mandatory.,0
[removed],this sub only exists because r/politics is mostly democratic territory,0
[removed],proposal for national commercial for the republican party,0
,there are actually some people who will vote for this man for potus...,0
,“conspiracy cult”,0
,the media's democratic ties,0
[removed],is this how it is ?,0
[removed],when can we get back to civil discourse?,0
[removed],r/republican vs r/politics,0
,senate to sba: we want answers about how planned parenthood got $80 million in covid-19 relief,0
,what do you all think about joe biden?,0
,"hey, joe biden, i’m black enough to think for myself",0
,thousands of churches to defy lockdown orders. it’s about time.,0
,cdc: coronavirus fatality rate could be as low as 0.26%,0
,"why do we have party whips? we elect officials to represent us, the constituents, then the parties have someone dedicated to making sure those officials vote with the party if the constituency would vote otherwise?",0
,people enjoying themselves at the lake of ozarks in missouri on memorial day weekend,0
"i do not live in the us but have many friends from there and i’m confused about something. they appear to be republicans (carrying trump signs etc) but at the same time are disrespected police officers? 

all the republicans i know respect authority and would never attack police and insult them the way these protestors are. 

are these a specific type of republican or are these not republicans and just crazy people? 
are there some republicans who do not respect the police?

i understand protesting is their right but they’re honestly kind of terrifying with it. why can’t they peacefully protest and not bring out rocket launchers and push around cops? 

thanks for reading sorry if this is a slightly uneducated question.

i’ve never never interacted with republicans who behave like this before they’re always so respectful to me and my country and my country’s laws so i’m a little shocked at watching american news lately.",soo these quarantine protestors..,0
,trump to investigate bias against conservatives on social media,0
,rep. steve cohen criticizes gop for giving rich a tax break | nowthis,0
,"disgusting traitor jeff 'slimeball' sessions tries to get president trump to back him. sorry jeff, we don't back losers!",0
,joe biden's top gaffes of the week,0
,black maga supporters stand up to joe biden,0
,joe,0
[removed],does anyone else feel like reddit is about 90% left wing loonies?,0
,maybe some of y’all will appreciate this.,0
[removed],take this liberals,0
,how the turn tables,0
[removed],trump nad perón,0
,new cdc figures show fauci's dishonest covid-19 projections were garbage,0
,google drive takes down user’s personal copy of judy mikovits’ plandemic after it was flagged by the washington post,0
,‘aka jane roe’: a heavily edited picture of complex woman who just wanted to be ‘norma’,0
,i’d like to solve the puzzle,0
,trump campaign announces launch of ‘truth over facts’ investigative website,0
,truth over facts,0
,"sharyl attkisson believes obama admin spied on ""many, many others""",0
,projection at its finest.,0
,obama should apologize to trump - most of what has transpired over the last three years could have been avoided,0
,let’s blame china | much of the western media is behaving like a subsidiary of the chinese communist party,0
,"a trump-friendly, anti-aoc democrat is poised to win a new york house seat",0
,please sign this petition to get kate brown out of office,0
,"if you don’t vote for me, then you ain’t...",0
,"taken from mr. larry elder’s ig profile, referring to biden",0
,nigerian scammers scam washington state out of over $100 million in unem...,0
,...,0
[removed],what do republicans stand for?,0
,i’m starting to wonder if leftists even have brains,0
,is this satire? the radical left ladies and gents.,0
[removed],very interesting article would love to see one today and see how the numbers have changed,0
,poll: democrats much more likely than republicans to snitch on neighbors for 'lockdown' fontviolations,0
,president trump: 'i have a chance to break the deep state',0
[removed],"congress’s 2020 fisa reform fight, explained",0
[removed],freedom is a slippery slope!,0
,"i've got to keep posting this from trump's snapchat, it's the funniest thing i've seen in a while.",0
,remember kids. reacting to blatant racism is outrageous according to cnn.,0
,we must not forget what freedoms were lost just north of us.,0
,study: a majority of the population may have 'some degree' of preexisting immunity to covid-19,0
,perry introduces legislation supporting hong kong’s democracy and freedom,0
,not even surprised...,0
,blind singer dedicates song to preborn children: ‘you’re welcome on earth’,0
,sorry y'all...,0
,follow the science...,0
,you won’t see this on cnn,0
,pro-abortion group wants fda to ‘seize website domains’ promoting abortion pill reversal,0
,they loved it until it affected them negatively,0
,"obama’s political police: liars, leakers and lawyers",0
[removed],biden and the breakfast club vs. trump's birtherism,0
,ted cruz rips apart hollywood celebrities submitting to china censorhsip!,0
,he’s all they have left,0
,"president trump: if abortion businesses can be called ‘essential,’ so can houses of worship",0
,melania trumps the obamas. democrats still can’t stand that their successors outshine them.,0
"i’m starting to think the democrats sincerely think trump is racist and that racism is so rampant in america that you have to be white to best donald trump. they nominated the most boring white dude ever to run against them thinking it’s about racism and not values. idk, maybe i’m crazy, but what the hell were they thinking nominating biden?",joe biden theory.,0
,"where is cuomo’s apology for killing 10,000 people? no ifs, no ands, no buts — just a tearful mea culpa from the nursing home killer.",0
,the cdc just gave us the biggest reason to end the coronavirus lockdowns,0
,"can we sue our way out of quarantine? the longer the lockdowns last and the less necessary that they seem, the more scrutiny courts will apply.",0
,"still more evidence that lockdowns were a massive waste of time, money, and lives",0
,the italian connection: why did the u.s. ambassador to italy and his deputy request unmaskings of flynn calls?,0
,michael flynn was not masked because the fbi framed him as a clandestine agent of russia,0
,lee smith: how russiagate began with obama’s iran deal domestic spying campaign,0
i can't even have an adult conversation with her about anything she doesn't agree with.she actually praised joe biden by his comment and said he should say that for mexicans wtf. she will get mad if i disagree about with basketball player is the goat and tells me to stfu because i don't think jordan is the best. hates trump while knowing nothing about how he helped blacks.,my mom has been brainwashed for being black.,0
,"mcenany schools reporters on 'good journalism', provides suggested questions on 'unmaskings'",0
,modern republicans,0
,racist or...,0
,fr. frank pavone: texts from norma mccorvey disprove ‘aka jane roe’ filmmakers’ claims,0
[removed],trump approval poll for covid-19 (help needed),0
,"when a democrat says a racist remark, its ""clearly a joke."" i can't wait for november to see them lose again!",0
,"""hey lejardin"" | bigg jah",0
,cnn's new coronavirus town hall was set to be more grim news,0
,this has to be the stupidest headline i’ve ever seen...,0
,joe biden does a meme on the breakfast club,0
[removed],wow not one negative thing today on biden!,0
,sowell: 'friends' of blacks,0
,i think this picture is going to be important in this election cycle. people show us part of what happened never what happened.,0
[removed],i must ask,0
,biden’s mental frailty makes him a teflon candidate,0
,lockdowns are as contagious as covid,0
,"a little gem meme, great for the kids that like touching leg hair, joe biden ""you aint black"" coffin",0
,pro-life activist assaulted outside new mexico’s late-term abortion business,0
,bet founder robert johnson: joe biden 'should spend the rest of his campaign apologizing to every black person he meets',0
,the unknown healthcare law that made lockdowns inevitable: ‘certificates of need.’,0
,a tale of two states — new york and florida. which today can only mean the tale of two very different governors.,0
,obamagate: of course it comes back to obama’s narcissism - how the obama administration stole the trump presidency,0
,never forget: hilary losing a rigged debate against donald trump,0
,rep. swalwell takes on acting dni richard grenell; gets crushed like a bug,0
,awful mitt romney joins with democrats to support mail-in voting,0
,"biden: 'if you don't let me sniff your hair, you ain't a woman'",0
,medical professionals recount stories of babies born alive during abortions,0
,"oh, is this one of those “acceptable” forms of racism?",0
,quid pro joe at it again,0
,survey on varying political parties and standpoint on the environmental worldview (americans 18+),0
,tim scott responds to biden's 'you ain't black' comment,0
,i made joe a campaign poster!,0
[removed],discussion: what's the best and worst decision donald trump and barack obama have each made in office?,0
,‘aka jane roe’ producers have strong pro-abortion bias… and one of them is tied to kamala harris,0
,omar-in trump's america i feel unsafe when practicing my religion,0
,survey on varying political parties and standpoint on the environmental worldview (americans 18+),0
[removed],joe biden blast charlemagne: you ain't black if you consider voting trump- black communities respond,0
[removed],joe biden blast charlemagne: you ain't black if you consider voting trump- black communities respond,0
[removed],joe biden blast charlemagne: you ain't black if you consider voting trump- black communities respond,0
,come on. biden’s ‘you ain’t black’ comment was clearly a joke. (that is the actual headline),0
[deleted],"if the president decided to make this kind of “joke”, he’d immediately be crucified.",0
,"nope, there’s no reason to believe that the suburbs are a lost cause for the gop.",0
[removed],illegal worker gathering spots. zero enforcement of covid-19 guidlines by nova police.,0
,model from missouri with down syndrome won’t ‘let her disability define her’,0
,more voting red flags as batch of south carolina ballots turn up... in maryland!,0
,desantis and florida emerge as trump showcase for reopening,0
,"kayleigh mcenany shuts down reporter: ""boy it's interesting to be in a room that desperately wants to seem to see these houses of worship &amp; churches stay closed.""",0
,"trump announces that houses of worship are ‘essential,’ calls on governors to open them up",0
,"shock: documents from new mexico facility reveal dozens of late-term, healthy babies aborted daily",0
,"the stay at home orders are doing more harm than good, these corrupt facist governers like jay inslee are trying to push policy during this that has already been voted down multiple times. it's absolutely discusting, they are ignoring the doctors, police, and economist advice. lawsuits should happen",0
,watch live: president trump demands governors reopen country’s houses of worship,0
,"biden says black voters considering trump over him ""ain't black""",0
,conservative gays represent!!,0
,"""if you have a problem figuring out whether you're for me or trump, then you ain't black"" - biden to black radio host",0
,how obama weaponized surveillance laws to target trump,0
,don’t fall for biden’s misdirections about not hiking your taxes,0
,don’t fall for biden’s misdirections about not hiking your taxes,0
[removed],2024 opinions,0
,"joe biden: ‘if you have a problem figuring out whether you’re for me or trump, then you ain’t black’",0
,biotech firm: screening to ‘avoid’ babies with down syndrome is a ‘cash cow’,0
,"joe biden: ‘if you have a problem figuring out whether you’re for me or trump, then you ain’t black’",0
,joe biden: vote for me or you’re racist.,0
,joe biden’s handlers are now having to interject during his interviews,0
,"biden tells charlamagne tha god, who is black, “i tell you if you have a problem figuring out whether you’re for me or trump, then you ain’t black” (17:25 or so)",0
,the railroading of michael flynn,0
,"joe biden's mind melts, says 'you ain't black' if you are an african-american who doesn't vote for him",0
,"cuomo, de blasio blame ignorance, but not themselves, in wake of damning report",0
,"trump spotted wearing mask during tour, but refuses to wear it in front of press",0
,"biden: 'if you have a problem figuring out whether you're for me or trump, then you ain't black'",0
,china v. trump: covid and the 2020 election,0
,finally! amy klobuchar admits miracle drug hydroxychloroquine saved her husband's life (video),0
,who believes the lockdowns were about science?,0
,joe biden shames black people if they won't vote for him,0
,the obamagate scandal just got even dirtier,0
,divided by covid-19: democratic u.s. areas hit three times as hard as republican ones,0
,https://news.yahoo.com/divided-covid-19-democratic-u-100249199.html,0
,covid-19 fear used to justify expanded government power,0
,new york governor cuomo shifts blame for covid-19 nursing home patient deaths,0
,"keeping america skeered - that’s what the democrats want, from now until election day.",0
,when all you have to do is do nothing. its over boys,0
,dershowitz doubles down: state can force vaccination if it's 'safe',0
,house dem criticizes her own party for shoving 'wish list' stimulus package: 'it's not a good look',0
,florida ruled to be in violation of science for not having more people die,0
,detroit police make arrest after horrifying video emerges of elderly man beaten at nursing home. governor gretchen whitmer silent.,0
,stacey abrams says she will step down as governor if asked to run for vp,0
,"no matter who biden picks, his running mate will be a ‘karen’",0
,"mayor was out partying during lockdown. when cops showed up, he hopped in a coffin and pretended to be dead.",0
,"georgia governor announces fewer than 1,000 hospitalized with coronavirus",0
,"wapo writer, harvard scientist explain the real reason republicans want to reopen for business",0
,"stacey abrams lashes out at 'white voting base,' laments illegal aliens ""are no longer able to elect anyone who represents them"" (video)",0
,‘china won’: tucker carlson details ‘uncomfortable facts’ about coronavirus response,0
,"guns, corrupt public defenders, and corrupt psychiatrist",0
[removed],follow me on instagram @1776.memes,0
,"her children went to foster care because of her addiction, but two years later they were reunited",0
,"senate confirms pro-qanon john ratcliffe as director of national intelligence, buckle up!",0
,“president” plump!!!,0
,"south philly judge of elections pleads guilty to stuffing ballot boxes, accepting bribes",0
,"but obeying the who is the responsible choice, right?",0
,ron desantis blasting media on state response coverage,0
,"united states coronavirus: 1,620,902 cases and 96,354 deaths",0
,pres trump just outfoxed schumer and pelosi in his reply to flag-lowering letter,0
,"how fear, groupthink drove unnecessary global lockdowns",0
[removed],question looking for information/research,0
,california doctors say they've seen more deaths from suicide than coronavirus since lockdowns,0
,what we can learn from coronavirus per capita death rates,0
,"amy ""karen"" klobuchar finally admits hydroxychloroquine saved her husband's life!",0
,end new york city’s lockdown now!,0
,china’s great civilisation is now ‘in the hands of thugs and gangsters’,0
[removed],new member,0
,philadelphia dem elections judge admits taking bribes to inflate vote counts,0
,south philly judge of elections admits he took bribes to stuff the ballot box for democratic candidates,0
[removed],storm,0
,"colorado citizens need 10,000 more signatures for chance to end late-term abortion in state",0
,appeals court orders judge in flynn case to explain actions in dismissal,0
,worth remembering?,0
are the democrats really going to put forth deteriorating joe biden as he diminishes before our eyes. i can’t see him surviving the convention. i thought the idea was to have an electable alternative to trump? biden is clearly not that person. it makes me wonder what the dems have up their sleeve,dem candidate,0
,watch: parents of of girl with brain abnormality say they’re ‘so happy’ she’s their daughter,0
[removed],aoc reparation payments for slavery,0
,senators send letter to doj urging investigation into planned parenthood for fraud,0
,the science of reopening,0
,"if trump loses in 2020, he’ll be the nominee again in 2024",0
,new york state's grim reaper...,0
,"the susan rice cya memo, unredacted",0
,this is why i'm a republican,0
,elise stefanik shuts down gov. cuomo's pathetic attempt to blame trump for ny nursing home crisis,0
,finally revealed: the whereabouts of kim jong un!,0
,muh freedom,0
,kayleigh mcenany grills reporters on zero coverage of susan rice email!,0
,democratic party official admits to stuffing ballot boxes in philadelphia elections,0
[removed],color scheme opinion for firearm owners,0
,"joe biden pushed max baucus for ambassador to china, he's now playing the role of chinese agent",0
[removed],what are examples of andrew yang being a generally uncharismatic candidate?,0
,broken elevator at dangerous illinois abortion center forces emts to carry injured woman down stairs,0
,how democrats are trying to use heroes act to buy young americans’ votes,0
,"92% of left-wing activists live with their parents, berlin study finds",0
,schiff still insists he has 'significant evidence' against trump,0
,major election update could change everything 🚨🚨,0
,"you okay, fredo? mcenany slams cuomo, lefty journalists bashing hydroxychloroquine",0
,nets skip bipartisan calls to probe why gov. cuomo put covid in nursing homes,0
,"cuomo thumbs nose at accountability for gov. brother, plays with giant swabs",0
,gov. cuomo blames trump for new york's thousands of nursing home deaths,0
,"‘bet you stay home now hypokrits’: church that refused to close during lockdown gets burned down, investigated as arson",0
,pennsylvania: case study in exploiting a crisis,0
,vice president alert – she says 'yes' 🚨🚨,0
,two new house members sign petition for born-alive abortion survivors protection act,0
,"for liberal elite, ignorance is strategy - but what will happen when biden emerges from his basement?",0
,the telephone bill comes for sundown joe - new reasons to suspect joe biden will not make it to the nomination finish line.,0
,an aristocracy of losers - how do the media choose the democratic party’s “rising stars”?,0
[removed],why is everyone against the lockdown?,0
,aoc-led push to kill amazon's nyc move under renewed scrutiny as city faces catastrophic job losses,0
,cnn praises governor cuomo for killing off the elderly since they probably would have voted for trump,0
,"as mask use rises dramatically, evidence for their effectiveness is 'sparse and contested'",0
