selftext,title,dem
,how biden could be the most liberal president in modern u.s. history,1
,"biden outraised trump in april, cutting into trump’s sizeable cash advantage",1
,employers struggle to compete with $600 coronavirus unemployment payments,1
[removed],join us federal government on discord!,1
,romney counters trump: 90 percent of 'very republican' utah votes by mail,1
,"advice for biden from buckminster fuller: don't try to change the system, propose a new one instead.",1
[removed],"i’m trying to get a sense of what the two main political parties in america think of the covid. if anyone has thoughts, comments, or opinions, please share in the comments",1
,this primary has shown that you can't hijack democrats with conspiracies but you can with the republicans: qanon supporter wins republican senate primary in oregon,1
,how biden wallops trump,1
[removed],you can't tell me the right is any kind of good. he knew a democrat would be appointed and used a pandemic to screw the public. #bluewave2020,1
,"trump says he would have done ‘nothing’ differently to stop pandemic as death toll nears 94,000",1
,anderson cooper reacts to 'utterly heartless' trump tweet - cnn video,1
,how can i be sick?’ woman who took hydroxychloroquine for 19 years to treat lupus still got covid-19,1
,tv host lashes out at 'sick' trump for suggesting she and husband got away with murder,1
,senior officials advised against trump emergency arms sales to saudis,1
,senior officials advised against trump emergency arms sales to saudis,1
,"dear usa, can you please do something about him yet? sincerely, a concerned european",1
,trump&amp;#x27;s &amp;#x27;obamagate&amp;#x27; conspiracy theory just got blown to pieces,1
,analysis | 49 of 50 governors have better coronavirus poll numbers than trump,1
,opinion | rep. katie porter: ppp loan grift is still happening — congress can't let greed win again,1
[removed],"unfortunately, we’re not set up to win in november",1
,illinois house removed gop rep from legislative session after he refused to wear a mask: 'a callous disregard for life',1
,"ian sams on twitter--pretty great: dana perino thinks she’s gonna stump @symonedsanders into a viral moment of being unable to name check a trump lie on coronavirus. instead, symone rattles off so many that perino has to interject to change the subject.",1
,we need this kind of leadership during trying times - lucky boys on becoming michelle obama on netflix,1
,lucky boys on becoming michelle obama on netflix - so inspiring makes me proud to be a democrat - we need this kind of leadership,1
,hillary rakes in millions for biden — but he's still far behind trump,1
,addressing inequality must be a priority,1
"trump tries to say vote-by-mail is fraught with fraud. he is correct when he says more of the voter fraud cases were from mail-in ballots. 

but the total number of voter fraud cases were only **491 out of billions** of votes cast.

* https://imgur.com/a/vxfzvct


source: https://www.factcheck.org/2020/04/trumps-latest-voter-fraud-misinformation/",the total number of voter fraud cases was just 491 — during a period in which literally billions of votes were cast,1
[removed],"for real: what are you gonna do if trump gets re-elected? as a conservative and asking sincerely, how can you believe that biden will get elected? he (biden is losing his mind) and you have no other candidate that stands a chance.",1
[removed],a revelation for hillary supporters,1
[removed],who else is concerned about the new election,1
,chris cuomo and andrew cuomo messing around with each other on cnn tonight (5/20/20) is must-see tv hilarious!,1
,"bernie sanders, seeking peace with joe biden, asks his own delegates to turn down the volume",1
"the us and brazil recorded more new deaths today than the rest of the world put together:

* https://i.imgur.com/nbjt4fg.png

* https://i.imgur.com/mc1kdpq.png

source: https://www.worldometers.info/coronavirus/#countries",the us and brazil recorded more new deaths today than the rest of the world put together,1
,"trump has ‘legal responsibility’ to wear coronavirus mask during ford factory visit, michigan attorney general says",1
,trump is brazenly interfering with the 2020 election,1
,"fox news pleads trump to stop poisoning himself with dangerous, unproven coronavirus treatment",1
,pelosi quips that trump has 'doggy doo on his shoes' in ongoing spat,1
,whitmer responds to trump's tweets on mail-in ballots,1
[removed],kaitlen bennett,1
,trump threatens funds for states that make voting easier - los angeles times,1
,"cowboys for trump founder, couy griffin: 'the only good democrat is a dead democrat'",1
,cuomo wants you to hear this one quote from trump - cnn video,1
[removed],almost every person in government has said that russia did interfere in the 2016 campaign. well the same thing is happening now!,1
,pelosi: 'morbidly obese' was taste of trump's 'own medicine',1
[removed],democrats are douchebags,1
,pelosi accuses gop of ‘political retribution’ in wake of subpoena vote,1
,ahmaud arbery got a bad attitude,1
[removed],book review: mitch please! along with my takeaways,1
,"trump steps up attacks on mail vote, making false claims about fraud",1
,michigan attorney general calls on trump to wear a mask on visit to ford plant,1
,pelosi accuses gop of ‘political retribution’ in wake of subpoena vote,1
,furious nancy pelosi demands a complete ban…,1
,"democratic legislative campaign committee: breaking: democrats have officially flipped 450 state leg seats since trump was elected! from medicaid expansion to lgbtq rights to raising the minimum wage, these democrats are improving people’s lives every day. keep the blue wave rolling!",1
,fired state department watchdog was probing protocol office,1
,"trump is a child with 'doggy doo' on his shoes, pelosi says doubling down on obesity comments",1
,believer in qanon conspiracy theory wins republican senate nomination in oregon,1
[removed],does biden really have a chance to beat trump?,1
,believer in qanon conspiracy theory wins republican senate nomination in oregon,1
[removed],anyone else worried about stacey abrams’ weight?,1
,gop house candidate demeans muslims and compares dreamers to pedophiles,1
,"during coronavirus crisis, more voters hold trump, not obama, responsible for the economy",1
[removed],"if you guys are unhappy about the trump administration, let's do something about it!",1
,is this true?,1
,"republican voter suppression failed in wisconsin, according to new data",1
,trump is brazenly interfering with the 2020 election,1
[removed],"biden comes up with a nickname for trump: ""president tweety"". wow. get ready for another 4 years of trump.",1
,facebook is letting the trump campaign publish at least 529 false ads accusing the left of voter fraud,1
,"nsé ufot, new georgia project action fund: 'we need a whole new plan for black voters in the south'",1
,trump threatens retaliation against michigan and other states that make it easier to vote,1
i have no idea how technology works. so no crosspost. christopher hale is an obama administration alumni and congressional candidate for tennessee's 4th congressional district. questions start at 1pm on votedem,"[ama on votedem]i’m christopher hale. i’m a rural democrat running against a congressman who pulled a gun on his first wife and shot it, forced her and mistresses into three abortions, and illegally prescribed painkillers for a patient he was sleeping with while married. ask me anything.",1
[removed],"[ama on r/votedem]i’m christopher hale. i’m a rural democrat running against a congressman who pulled a gun on his first wife and shot it, forced her and mistresses into three abortions, and illegally prescribed painkillers for a patient he was sleeping with while married. ask me anything.",1
,"sen. jeff merkley trashes trump, gop for opposition to mail-in ballots: they’re ‘trying to stop people of color from voting’",1
,kamala harris: he’s spinning out of control because he’s going to lose. vote.,1
,"i’m christopher hale. i’m a rural democrat running against a congressman who pulled a gun on his first wife and shot it, forced her and mistresses into three abortions, and illegally prescribed painkillers for a patient he was sleeping with while married. ask me anything.",1
,"more voters trust former vice president joe biden to contain the coronavirus pandemic than president trump, according to a new morning consult poll released on wednesday, suggesting that the presumptive democratic presidential nominee is making inroads on the issue",1
,we need a whole new plan for black voters in the south,1
,senate republicans aim to turn biden-burisma conspiracy theory into baseless investigation,1
,"caving to pressure from trump, lindsey graham will seek broad authority to subpoena obama officials",1
,"trump calls high number of coronavirus cases in the us a 'badge of honor,' attributes it to testing",1
,"voters in swing states are sharply divided along partisan lines over the coronavirus pandemic with just under six months to go before election day, according to a new cnbc/change research poll.",1
,'we've been muzzled': cdc sources say white house putting politics ahead of science,1
[removed],"so biden is now leading in arizona, florida, and virginia.",1
,this 2020 presidential forecast says trump faces historic defeat due to terrible economy,1
[removed],democrats should adopt a conservative social policy or be open to pro life candidates. pro life democrats ein primaries and are able to appeal to rural voters!,1
,here’s how the early battleground map has opened up for joe biden,1
,how tucker carlson manipulates president trump,1
,'what in god's name is he doing?' biden rips trump's use of hydroxychloroquine,1
,the most important election of 2020,1
,biden: ‘no worker’s life is worth me getting a cheaper hamburger’,1
,michigan is sending applications for mail-in voting to all voters statewide,1
,doctors are running into death like ‘soldiers run into bullets’ &amp; it's beautiful - trump,1
,so the republican senate candidate in oregon is a fucking qanon believer.,1
[removed],"coming from someone who dated a woman with anorexia, nancy pelosi should not be calling trump morbidly obese",1
[removed],"why i, a leftist, dislike the democratic party",1
,"fact check: trump falsely denies fda warning on hydroxychloroquine, baselessly alleges political bias in study fact check: trump falsely denies fda warning on hydroxychloroquine, baselessly alleges political bias in study",1
,"judge allows fraud suit against trump, family and company to proceed",1
,"while pushing big oil bailouts, trump slaps wind and solar firms with $50 million in old rent bills",1
[removed],"as someone who dated a woman with anorexia, nancy pelosi should not be calling trump obese",1
,florida scientist fired for refusing to manipulate covid data,1
[removed],biden wins oregon primary,1
,tommorow: protestors hold national day of mourning over covid republican response,1
,'it's sick': biden blasts trump jr.'s pedophilia 'joke' - he is his father's son,1
,"warren, levin, merkley, smith introduce legislation for a national contact tracing program | u.s. senator elizabeth warren of massachusetts",1
,"breaking: trump just removed the ig investigating elaine chao. chao’s husband, mitch mcconnell, already vetted the replacement.",1
,"breaking: democrats have officially flipped 450 state leg seats since trump was elected! from medicaid expansion to lgbtq rights to raising the minimum wage, these democrats are improving people’s lives every day. keep the blue wave rolling!",1
,"breaking: democrats have officially flipped 450 state leg seats since trump was elected! from medicaid expansion to lgbtq rights to raising the minimum wage, these democrats are improving people’s lives every day. keep the blue wave rolling! water wave",1
,10 most terrifying objects of the warren museum!,1
,federal judge rules texans afraid of catching covid-19 can vote by mail,1
[removed],book review: mitch please! along with my takeaways,1
[removed],book review: mitch please! along with my takeaways,1
,trump says it's 'badge of honour' for us to lead world in coronavirus cases,1
,"trump: ""we're going after virginia, with your crazy governor, we're going after virginia. they want to take your second amendment away. you'll have nobody guarding your potatoes.""",1
,"cnn: president obama zings donald trump, birthers at white house correspondents' dinner : this is one reason why trump is upset with obama.",1
,democrats blast removal of acting dot inspector general,1
,trump says high number of coronavirus cases is 'badge of honor' showing high testing,1
,paulette jordan is looking for volunteers for phone banking! intro phone banking even 6-7pm mt time! to take a look at her policies hers her site! https://pauletteforsenate.com/ if your interested in helping stop on by.,1
,"donald trump 'no, i don't take any responsibility at : and never has in his life.",1
,"donald trump, ""no i don't take responsibility at all""",1
,new arizona poll shows republican senator martha mcsally in trouble against mark kelly,1
,"congresswoman pramila jayapal's campaign takes annual payments from the nfl through their official pac ""gridiron pac""",1
[deleted],"donald trump 'no, i don't take any responsibility at all'",1
,turkeyneck mitch blocks minimum wage increase,1
"making calls is a powerful way to take action from home—sign up to phone bank with us on may 30th!

whether it’s your first time making calls or you’re a veteran phone banker, we need your help! together, we can defeat trump’s agenda. there’s no time to waste!

once you sign up for a shift, you'll receive an email with everything you need to join the virtual training. all materials and information on how to make calls will be shared during the training.

join us:

[https://fl.organizing2020.org/dcdialer](https://fl.organizing2020.org/dcdialer)","florida action --&gt; to defeat trump’s agenda, we need to start organizing. join us.",1
,"jordan klepper vs. trump supporters. a good laugh about how stupid people are, and then a good cry about how stupid people are.",1
[removed],republicans for joe biden,1
,trump announces executive order aiming to make hundreds of deregulations amid coronavirus permanent,1
,"maybe trump isn’t lying, the president does not seem to grasp the most basic aspects of the public-health crisis.",1
,trump lashes out with distractions and disinformation,1
[removed],joe biden made a promise in march to select a female running mate.,1
,poll: trump and biden running neck and neck in georgia,1
[removed],the corruption of the right knows no bounds.,1
[removed],the corruption of the right knows no bounds.,1
[removed],the corruption of the right knows no bounds.,1
[removed],the corruption of the right knows no bounds.,1
,history of the u.s debt clock,1
[removed],can you believe the president said this?,1
[removed],hello i am a right leaning self proclaimed conservative and i want to learn more about the left leaning “progressive” point of view feel free to comment on this with your side i would gladly have a discussion,1
,opinion | give trump all the rallies he wants,1
,trump is attacking the final safeguard against executive abuses,1
,"new priorities usa ad: ""pause - medicare""",1
,new priorities usa ad: way down,1
,new priorities usa ad: wasted time,1
,new priorities usa ad: mission accomplished,1
,new priorities usa ad: didn't listen,1
[removed],so sick of these divisive trolls,1
,new priorities usa ad: great job,1
[removed],"i am not american so i cannot participate in the electoral process this november, however i will carry people on my back to the polls if need be...",1
,"trump recruiting 50,000 polling site monitors in thinly veiled attempt to harass and intimidate voters, activists warn",1
,"third way climate &amp; energy: last night during the #ny14 debate, @aoc made it clear that the door is open for on nuclear energy in the #greennewdeal 💯👏 ""the gnd leaves the door open for nuclear,"" but community input &amp; vetting new technologies is key. 1/",1
[removed],trump 2020,1
,iatse endorses joe biden for president,1
,"freed by court ruling, republicans step up effort to patrol voting",1
,this is sickening. the only reason the republicans are doing this is to suppress minority voting. typical.,1
,house dems pass defense budget on republican terms: 7 key takeaways,1
,democrats could pick up two senate seats in georgia (but it's tight),1
,house democrats unite to pass $733b defense bill for trump! thank you democrats!,1
[removed],not every trucker is a trump supporter,1
,not every trucker is a white conservative trump supporter,1
been having some fun with this. 😈,i’m not sure if anyone else has figured this out but republicans are terrible at debating without headline talking points to chase or enforce.,1
,‘obamagate’ is just trump’s latest effort at distraction,1
,"the cruelty of trump’s ice under covid-19 | the pandemic risks turning immigration detention into a death sentence for many, yet the trump administration has rejected calls for mass humanitarian release, and continues to deport infectious detainees to latin america.",1
,"the cruelty of trump’s ice under covid-19 | the pandemic risks turning immigration detention into a death sentence for many, yet the trump administration has rejected calls for mass humanitarian release, and continues to deport infectious detainees to latin america.",1
,"georgia gop cancels supreme court election, meaning governor can appoint a republican",1
,will it be a second stimulus check?,1
[removed],"just saw mcsally’s new commercial blaming china just like trump ( she’s a clone ) and saying bring back pharmaceuticals and manufacturing home to america, ha you better talk to your boss.",1
,opinion: trump takes hydroxychloroquine every day because what do scientists know anyway?,1
,poll: biden leads trump by double digits in virginia,1
,arizona senate poll: mark kelly(d) leads martha mcsally(r) 51-38. biden leads 50-43,1
,people of kentucky....heads up!,1
,why is trump so obsessed with obama?,1
[removed],"democrats sub rules state i can't link to biased websites, yet allows cnn",1
,thats a little weird,1
,"while we fight democrats vs republicans, we have no time to notice crimes being committed against us all",1
,barr disputes trump’s ‘obamagate’ allegations,1
,trump needs to experience his own tactics.,1
,btrtn: the importance of preaching to the choir,1
,trump refuses to invited president obama to the white house for portrait unveiling,1
,why the gop's 'war on voting' will reach a new level in 2020,1
[removed],barda awarded this contract. is this why dr. bright was forced out?,1
,florida boy scoutmaster ken madley tweets disgusting photo of michelle obama,1
,trump is attacking the final safeguard against executive abuses,1
,trump slams fox after hydroxychloroquine warning: 'looking for a new outlet',1
,cooper claps back at trump jr. over thunberg 'drama',1
[removed],cooper claps back at trump jr. over thunberg 'drama',1
[removed],pelosi calls it,1
,guns for sales | buy guns online 2020,1
,trump says it's ok for pompeo to have a paid government employee wash dishes if his wife or son isn't there,1
,trump says he’s taking hydroxychloroquine against covid-19 despite fda warnings,1
,trump says if pompeo's 'wife isn't there' a staffer should do the dishes so he can work,1
,nancy pelosi fears for 'morbidly obese' trump after hydroxychloroquine admission,1
,"trump threatens to permanently cut who funding, says he is taking hydroxychloroquine",1
,trump says it's ok for pompeo to have a paid government employee wash dishes if his wife or son isn't there,1
,"i thought you guys might be interested in this sub. their attack ads against trump are phenomenal and they are pro joe biden, i believe",1
,"aoc owes $2,000 in unpaid taxes from failed business venture",1
,pastor john pavlovitz details the 5 reasons white evangelicals worship trump,1
[removed],is it okay to take back consent after having had sex,1
,"pro-trump republican tries to troll democratic rep. ilhan omar, inadvertently trips up trump: report",1
,opinions on our newest creation for the upcoming 4th july? :),1
,so trump is taking hydroxychloroquine to prevent the so-called “democrat hoax” anyone else think maga is a suicide mission?,1
[removed],let’s be honest.,1
,nancy pelosi says 'morbidly obese' trump should not be taking hydroxychloroquine,1
,"beyond sexual harassment, lesser known scandals could cost the murdochs a $14b deal (the family that owns most of fox news)",1
,"aprildryan on twitter - i’m hearing on good authority that #coronavirus is more rampant in the #whitehouse than the public is being told. a very high-ranking individual may have also been impacted! the administration is currently mum on the matter, seeking prayers instead. #covid19",1
,"obama's trump attacks electrify democrats, anger gop",1
,president trump said monday that he was “surprised” by attorney general william barr’s statement that he doesn’t anticipate a criminal investigation into former president obama or former vice president joe biden,1
,president trump said monday that he was “surprised” by attorney general william barr’s statement that he doesn’t anticipate a criminal investigation into former president obama or former vice president joe biden,1
,jake tapper responds to trump's baseless twitter accusations - cnn video,1
,the 59 worst lies trump told about coronavirus in the past month,1
[removed],r/lookatthesubyouron,1
[removed],boycott taco bell!!! the ceo has donated a large amount to trump’s reelection campaign.,1
[removed],he really is quite something....,1
[removed],hail communism/socialism and fuck capitalism,1
,trump says he is taking hydroxychloroquine,1
,trump says he's taking malaria drug in case he gets virus,1
,trump claims to have been taking hydroxychloroquine despite fda warnings – live,1
,"donald trump reveals he is taking hydroxychloroquine, the drug he touts as coronavirus treatment",1
[removed],trump claims to have been taking hydroxychloroquine despite fda warnings – live,1
,ignorance as strength: the three pillars of the trump presidency,1
,trump has consistently contradicted his own coronavirus task force concerning a second wave of the virus this fall. this article examines the claims and counter-claims and looks at the evidence to get at the truth.,1
,grassley demands trump explain firing of state department inspector general,1
,state department ig trump fired was investigating saudi arms sale,1
,gop sen. ben sasse just gave 'the worst graduation speech of all time',1
,"freed by court ruling, republicans step up effort to patrol voting: officials seek to recruit 50,000 poll watchers and spend millions to fight voter fraud. democrats say the real goal is to stop them from voting",1
,swing-state republicans warn trump's reelection is on shaky ground,1
,swing-state republicans warn trump's reelection is on shaky ground,1
,ousted state dept. watchdog was probing trump's saudi arms sales,1
,revealed: fired state department ig was probing trump administration’s potentially illegal saudi arms sales,1
,"immigration agency that issues visas, green cards struggles to stay afloat - u.s. citizenship and immigration services has asked congress for a lifeline amid the coronavirus pandemic that has caused applications to plummet and brought it to the brink of insolvency.",1
,"ousted watchdog was examining arms sale to saudis, democrat says",1
,ousted state dept. watchdog was probing trump's saudi arms sales,1
,"russia probe is unlikely to lead to prosecution of barack obama or joe biden, attorney general barr says",1
,"barr doesn't expect obama, biden criminal investigations",1
,trump’s purge just got much more corrupt. here’s what’s coming next.,1
,"amy klobuchar: when barack obama was president, you turned the volume up on the tv when he spoke so your kids could listen. we can't do that with the current president. but i'm thankful president obama can still give words of wisdom to guide the next generation (and all of us!) on our path.",1
,commence change,1
[removed],let’s talk about tyranny and what it means,1
,"trump officials deflect blame for us death toll, escalate reopening push",1
,mj hegar (democratic candidate for texas u.s. senate election) is holding a virtual town hall with gabby giffords about gun violence prevention today at 3pm pst,1
,"fired state department watchdog was probing whether pompeo made staffer walk his dog, pick up laundry",1
,the truth about obamagate exposed!!!,1
[removed],trump calls legally protected whistleblowing a 'racket' as fired scientist rips president's failed covid-19 response,1
,schwarzenegger holds up mock trump university diploma in commencement speech,1
,"link to csv with net approval changes for all reps, govs, senators, and president from february to may",1
,"biden now leads with most senior demographics — older americans' support for trump has collapsed — ""let grandma die"" proves unpopular with grandma",1
,the mueller interference everyone feared has happened — two years late,1
,"if we don't turn out the vote in november, i'm going to lose my mind.",1
,"trump tells susan collins ""i hope you are listening"" in rant calling for ""whistleblower racket"" to be looked at closely",1
,democracy dies in dysfunction,1
[removed],"""great people"" - djt",1
,obama reminds us what a us president should sound like,1
,"ap fact check: trump, gop falsehoods on flynn, biden, virus",1
[removed],swing states,1
,inspector general’s firing puts pompeo’s use of taxpayer funds under scrutiny,1
,"federal government buys riot gear, increases security funding, citing coronavirus pandemic",1
