selftext,title,dem
[deleted],exclusive excerpt—matthew whitaker: 'above the law: the inside story of how the justice department tried to subvert president trump',0
[removed],should it be a second stimulus check???,0
,tearjerker: dying birth mother meets twins she placed for adoption,0
,"as florida re-opens, covid-19 data chief gets sidelined and researchers cry foul",0
,nancy pelosi fears for 'morbidly obese' trump after hydroxychloroquine admission,0
,california man allegedly proceeded to strangle a child just 10 minutes after being released from jail,0
[removed],governors shouldn’t be paid,0
,obama on incompetence - a subject he mastered over eight excruciating years.,0
,mayor de blasio lays naval minefield to deter swimmers,0
,future leader of the republican party!,0
,trump will survive the covid-19 economy,0
[deleted],future leader of the republican party?,0
,gop chair: 'we will not be holding a virtual convention',0
,he do,0
,america is reopening itself: will politicians be able to stop it?,0
,new ministry aims to help women heal from abortion trauma,0
,trump tells who to make 'substantive improvements' or permanently lose u.s. funding,0
,"oh, about that ig 'wrongfully' fired by mike pompeo; turns out dems may want to hold their fire",0
,coronavirus crisis and andrew cuomo’s reckless choices,0
,projection at its finest.,0
,"the arts of government criminality - destroying or altering evidence, lying under oath, leaking classified info … but no pre-dawn televised raid for any of the wrongdoers.",0
,"gop senator ron johnson asks barr to declassify remaining portion of susan rice's january 20, 2017 email about secret oval office meeting",0
,trump threatens to keep who funding freeze in place after wh investigation,0
,alan dershowitz: state has right to 'plunge a needle into your arm',0
,pelosi: trump should not take medication prescribed by his doctor because trump is ‘morbidly obese’,0
,so banning guns made it...worse?,0
,huge scandal: oregon changes hundreds of republican ballots to “non partisan” denying gop voters the right to participate in primary,0
[removed],"i love when i go on omegle and get told to kill myself because i like trump, i know this just shows that republicans are better people because we don't do that to democrats but it still gets to my head you know because it feels like no matter were i go on the internet i'm hated.",0
[removed],is it okay to take back consent after having had sex?,0
,if america does not deal with the deep state it may no longer be a free state.,0
,don’t come too soon,0
[removed],noice,0
,spread the message. #reform #amendment34 #boog,0
,"i appreciate honesty and i enjoy learning because there’s no way i know it all. i lean left, but this kinda put me through a ringer.",0
,"this is the only proof i need. scheduled a visit to my doc tomorrow to plead my case. if he doesn't prescribe it, i'll do what the dirty dems do and buy it off the streets.",0
,the swedish alternative: coping with a virus while preserving livelihoods and liberties,0
,why donald trump could thank the media if he wins reelection this fall,0
,someone finally calling out the un: usaid head to un secretary general: stop peddling abortion as covid-19 relief,0
,"security guards drag several pro-democracy lawmakers from the hong kong legislature. after 9+ pro-democracy lawmakers are forcibly removed, the vote procedes. pro-communist starry lee is unanimously elected as chairperson.",0
,come with me if you want to live,0
,one of biden’s finest speeches...,0
,tyrants gone wild!,0
,karens incoming in 3...2...1...,0
,trump derangement syndrome has introduced impeachment 2.0,0
,france realizing why americans make fun of them so much,0
,welp! i should start taking it too,0
,"new york times writer advocates for abortion pill by mail, flouting fda safety regulations",0
,ben sasse picks the correct fight with his democrat challenger,0
,democrats slef-importants versus reality,0
,a republican path to the ballot box in 2020,0
,how democrats lost a house seat in california,0
,coronavirus rant! (small business gone?),0
,taxpayers are funding experiments on aborted children at uc san francisco,0
,vote blue no matter who!,0
,the facts are here and dems are still saying otherwise,0
,women should go to jail for false rape allegations.,0
,"the left is what it once loathed - what is the left, then? mostly a jacobin party that operates ad hoc, without principle, or consistency.",0
,i know this is a meme but this sums up politics and political humor,0
,suck it fuckers,0
,tsmc halts new huawei orders after us tightens restrictions,0
,biggs: nancy pelosi’s coronavirus bill has allowed her to seize more power,0
,pro-abortion activists raised enough money to buy alabama’s most profitable abortion business,0
,we have been lied to: 6 facts that change everything we know about sars-cov-2,0
,"new york gov cuomo ""because we did not have the facts!""",1
,gov andrew cuomo announcement on memorial day,1
,the democrats now openly ask china to back them.,1
,joe biden tells black trump supporters “you ain’t black”,1
,an honest brooklyn perspective on yet another “problematic” joe biden interview,1
[removed],democrats are stupid,1
,staten island shoppers with masks drive out non-mask wearing person in grocery store,1
,federal court backs california gov. gavin newsom's orders keeping churches closed,1
,fake news: a political weapon,1
,scott walker is peddling the deadly snake oil of austerity,1
,trump steps up purge of federal watchdogs,1
,it’s not obesity. it’s slavery.,1
,mail-in voting triggers an unhinged trump rant,1
,btrtn: “freedom” in the age of the coronavirus,1
,deathbed confession of jane roe fits pattern of conservative politics,1
,trump flips out after biden ad rips him for golfing amid growing death toll,1
,trump white house ‘flailing’ because they see election slipping away.,1
,"donald trump, the most unmanly president.",1
,breakfast club host charlamagne tha god defends biden's support for black community,1
,more than 40% of republicans in a new poll say they think bill gates wants to use covid-19 vaccines to implant location-tracking microchips in recipients,1
,trump sabotaged america’s recovery even before covid-19 began,1
[removed],a question to sanders supporters who are against voting for biden,1
,biden swipes at trump: 'presidency is about a lot more than tweeting from your golf cart',1
[removed],some questions about healthcare,1
[removed],advice?,1
,"president trump spent part of his memorial day weekend using his twitter account to promote personal attacks on democrats, retweeting posts that took aim at former georgia gubernatorial candidate stacey abrams’s appearance and another that called hillary clinton a “skank,” among others",1
,chris wallace demolishes trump’s mail-in voting lies: ‘no history of fraud’,1
,"florida law restricting felon voting is unconstitutional, judge rules: a federal judge said the law would result in discrimination against felons who cannot afford to pay court fines and fees",1
,"florida law restricting felon voting is unconstitutional, judge rules: a federal judge said the law would result in discrimination against felons who cannot afford to pay court fines and fees",1
,"rose calls for use of defense production act to ensure small businesses have access to needed ppe, supplies to safely reopen",1
,17 subtle signs you’ve already had coronavirus,1
,democrat tiktoks are the best,1
[removed],"psa: since the first case of covid-19 in the us on jan 20, trump's inaction has resulted in us experiencing approximately 1 pearl harbor's worth of casualties every 3 days!",1
,"duckworth, warren, markey and colleagues urge trump administration to prepare for simultaneous peaks of 2020 flu season, covid-19 outbreak",1
[removed],what do you guys think the convention is gonna be like. who speaks?,1
,trump gutted the checks on his power when they were most needed,1
,why donald trump's wild weekend can't be normalized,1
[removed],whats the plan for the communities and families that will be negatively affected if we get rid of the fossil fuel industry?,1
,democrats see warren as rising vp contender as coronavirus reshuffles 2020 race,1
[removed],a question about biden,1
,federal judge guts florida law requiring felons to pay fines before they can vote,1
,what the polls say about donald trump vs. joe biden in key 2020 swing states,1
,gop lawmaker calls on trump to stop promoting scarborough conspiracy theory: 'it will destroy us',1
,and now a message about sacrifice,1
,trump rips columbia as 'disgraceful institution' after study showed lives lost due to delayed shutdown,1
,the other dangerous virus infecting our country,1
,democrats think they can win iowa's senate seat and defeat incumbent joni ernst,1
[removed],introduce me to the american politics.,1
[removed],"on memorial day, we americans remember those military men and women who gave their lives in service to our country. this memorial day falls on an important election year, an election that will determine the character of our country. please remember and remind others of these quotes...",1
[removed],healthcare: biden's plan vs alternative systems,1
,democrats prepare for worst case situations,1
,"punching upwards: somebody is raising money for charity by making t shirts that poke fun at donald trump, and it's kind of awesome...",1
,"despite trump opposition, it's 'difficult to tell' if country may need to close again: birx",1
,fda commissioner issues memorial day warning: 'coronavirus is not yet contained',1
[removed],the about info for this sub is false,1
[removed],do i become black if i vote for joey biden?,1
[removed],prediction for why andrew cuomo will replace joe biden as the nominee,1
,what do you all think about joe biden? i’m new to politics ...,1
[removed],all of a sudden republicans care about racism...,1
,this is what’s happening right now at the lake of the ozarks in missouri,1
[removed],discord government rp | looking for leftists and democrats!,1
,michael moore: the only way trump wins in 2020 is if he 'cheats',1
,president trump seen doing same thing he criticized president obama for during ebola outbreak - cnn video,1
[removed],an idea to counter trump's dangerous pandering to religious conservatives:,1
[removed],test,1
[removed],what is the worst thing donald trump has ever said?,1
,youaintblack,1
[removed],is tara reade’s allegation less believable in the wake of norma mccreavy’s (jane roe) admission that she was paid by anti-abortion advocates to switch sides?,1
[removed],former democrat now a die hard trump supporter.,1
[removed],all republicans must commit to the following: list of things they should not be allowed to complain about.,1
[removed],fuck el patio! this place is spreading coronavirus!,1
[removed],subscribe to trumps newsletter and campaign,1
,"36,000 americans could be alive today if president trump had acted sooner. let's put that into perspective:",1
,why does the u.s. military celebrate white supremacy? it is time to rename bases for american heroes — not racist traitors,1
[removed],why do republicans hate college?,1
[removed],why can cohen and manafort go home but not hispanics or black people who committed petty crimes or non-violent misdemeanors?,1
[removed],pennsylvania and michigan voted for trump in 2016. they both now seem to be voting for biden in 2020. we have taken the first step in creating a blue wave!,1
[removed],"the number #1 goal that will help make this new decade the best ever: vote out every republican. federal, state, and local.",1
[removed],"if joe biden wins the election, the new decade will redeem itself.",1
[removed],how many of you guys are mentally handycapped,1
,"for some seniors, virus is shifting their views of trump - president trump’s approval rating has fallen among older americans, many of whom feel especially isolated and at risk. even a small shift among this bloc of voters could pose a serious threat to the president’s reelection.",1
,"for some seniors, covid-19 is shifting their views of trump",1
[removed],where is bloomberg's billions?,1
,trump’s snake oil fail - a legal analysis by glenn kirschner,1
,the electoral college is not democratic — nor should it be,1
[removed],"congress’s 2020 fisa reform fight, explained",1
,"will the coronavirus kill what’s left of americans’ faith in washington? in 2019, just 17 percent of americans said they trusted the federal government to do the right thing. the pandemic appears to be eroding their faith even more",1
,doug jones: while these two fight over their big mistakes let’s make sure alabama doesn’t make one with either sessions or a former football coach. i could sure use your help folks!,1
,united states of america gdp by states (1963-2019),1
[removed],joe biden telling black voters “you ain’t black” is just another reason why he won’t win come november.,1
,poll: national latino support for biden sees slight increase,1
[removed],serious question from slightly right leaning person,1
[removed],where is all the outrage for biden's comments?,1
,right-wing media are trying to scare you into voting in person during a pandemic,1
[removed],russian trolls: am i the only one who suspects them?,1
,"coronavirus: republican lawmaker kicked out of illinois house session for refusing to wear mask - 'the representative has shown a callous disregard for life, callous disregard for people’s health'",1
,trump heads to golf course for first time since lockdown.,1
[removed],"to show democrats are the only ones who are serious about covid, we should propose legislation that makes medical grade masks available direct by mail to american homes (after medical professionals are fully stocked)",1
,people defending joe biden saying this are no better than trump supporters defending trump suggesting injecting disinfectants,1
,trump press secretary scolds media for not spreading obamagate conspiracy,1
,trump calls dana nessel the ‘wacky do nothing attorney general of michigan’ — here’s how she is responding,1
[removed],you ain't black,1
,barack obama poised to add his star appeal to joe biden's campaign,1
,it's now become clear exactly how republicans might try to overturn a biden victory in november,1
,donald trump's terrible record,1
,donald trump's terrible record,1
,"biden says “if you can’t choose me over trump, you ain’t black”",1
,judge is ordered to explain handling of flynn case as f.b.i. announces review,1
,"georgia is a swing state in 2020 — ""georgia is definitely in play in the 2020 presidential election""",1
[removed],"if you consider the presidential bookends of george w and trump for context, is obama the greatest president of all time? ...i miss him.",1
,"life at the trump tailgate: spiked slurpees, culture wars and the coronavirus hoax",1
,kayleigh mcenany press secretary shuts down question on reopening churches reporter jeff mason,1
,rep. deb haaland talks trump's administration's failure to help native americans during covid-19,1
,"hydroxychloroquine: trump's covid-19 'cure' increases deaths, global study finds",1
,trump’s plan for coronavirus second wave shows he’s learned absolutely nothing,1
[removed],any stats on how many trump “supporters” exist in social media that are actually bots? that twitter article got me curious.,1
,sarah cooper on twitter: use the link,1
,sarah cooper on twitter,1
,sarah cooper on twitter,1
,biden apologizes for saying voters who back trump 'ain't black',1
,"6 months on, trump hasn't completed his physical. the white house won't say why.",1
,"6 months on, trump hasn&amp;#x27;t completed his physical. the white house won&amp;#x27;t say why.",1
,the best way to lampoon trump: his own words,1
,jimmy kimmel roasts trump for falsely claiming he was 'man of the year' in michigan,1
[removed],it’s honestly embarrassing that our top candidate is biden.,1
[removed],i am sick of democrats being too soft on the republicans' misconduct,1
,"roughly half the twitter accounts pushing to 'reopen america' are bots, researchers found",1
[removed],help for nearly-citizens in legal limbo.,1
,we need to talk about joe biden’s breakfast club interview,1
,"joe, pete and adi",1
[removed],why isn't biden on the front page of the democratic subreddit?,1
,"joe biden's campaign manager right after the ""you ain't black"" comment",1
,congressional republicans and white house fear pandemic unemployment benefits are ‘a barrier to getting people back to work’,1
[removed],sooo how do we feel about nj voting fraud and california double ballots picture from california floating around?,1
,coronavirus is spiking disproportionately in counties that voted for trump in 2016,1
[deleted],"[cnn] biden: 'if you have a problem figuring out whether you're for me or trump, then you ain't black'",1
,debunking ben shapiro's claim that biden is racist,1
,"listen to what trevor noah has to say about the black vote, gets good at 3:25",1
[removed],presidential pick and delegate votes? - primary question,1
[removed],what are some of your favorite reasons as to why you think donald trump is not fit/ shouldn't be re-elected as president.,1
[removed],what’s wrong with trump?,1
,new study finds chloroquine doesn’t help covid-19 patients — and it might even hurt,1
[removed],what are some of your favorite reasons as to why donald trump isn't fit/ shouldn't be re-elected as president?,1
[deleted],trump: 'we are not closing our country' if second wave of coronavirus hits,1
,survey on varying political parties and standpoint on the environmental worldview (americans 18+),1
,behind trump’s demand to reopen churches: slipping poll numbers and alarm inside his campaign,1
,"“if you have a problem figuring out whether you’re for me or trump then you ain’t black,” says biden",1
,recently nominated republican senate candidate jo rae perkins (ore.) on wednesday contradicted her own campaign by saying she stands with qanon,1
[removed],discussion: what's the best and worst decision donald trump and barack obama have each made in office?,1
,masks vs.no masks-the culling of the working-class. — the pandemic caused by privilege and capitalism part 6,1
,survey on varying political parties and standpoint on the environmental worldview,1
,trump claims authority to reopen states in wake of coronavirus. legal scholars disagree.,1
,trump losing support among white evangelicals,1
[deleted],trump claims &amp;#x27;total&amp;#x27; authority to reopen states in wake of coronavirus. legal scholars disagree.,1
,did 'live and let die' play as trump toured factory without covid-19 mask?,1
,trump declares houses of worship essential and claims he will override governors if they disagree,1
,"kayleigh mcenany: ""boy it's interesting to be in a room that desperately wants to seem to see these houses of worship &amp; churches stay closed."" reporter: ""kayleigh, i object to that. i go to church. i'm dying to go back to church. the question that we're asking... is it it safe?""",1
,michigan doctor: trump is ‘failing us yet again’ by not wearing a face mask | the last word | msnbc,1
,researchers: nearly half of accounts tweeting about coronavirus and us reopening are bots,1
,i dug into some fdr broadcasts looking for inspiration. i found something that fit the current day so well that i made this video.,1
[deleted],i dug into some fdr broadcasts hoping to find some inspiration to get me through the current crisis. i found something that fit the times so well that i created this video.,1
[removed],jemele hill coming to biden’s defense on twitter regarding his comments from the interview with charlamagne,1
,"how the trump effect could lift democratic senate candidates: republican incumbents in swing states have struggled to disentangle themselves from president trump, whose voters are loyal but represent a minority of the electorate.",1
[deleted],top #metoo lawyer says he is no longer representing biden accuser tara reade,1
,internet speech will never go back to normal,1
,michigan doctor: trump is ‘failing us yet again’ by not wearing a face mask | the last word | msnbc,1
,"steve king's racist rhetoric may finally cost him his seat in congress - after years of racist remarks and coziness with right-wing fringe activists, the iowa republican is isolated, out of money, and looking like the underdog for his june 2 primary.",1
,the cult of paul joseph watson/infowars,1
[removed],[ga] am i too late for primaries?,1
[removed],[ga] am i too late for primaries?,1
,jimmy kimmel roasts trump after he again falsely claims he was ‘man of the year’ in michigan,1
[deleted],how the trump effect could lift democratic senate candidates,1
,tara reade is dropped as client by a leading #metoo lawyer,1
,"in virus chaos, some find solace, purpose in helping others",1
[removed],"""if you have a problem figuring out whether you're for me or trump, then you ain't black."" - joe biden in his interview today on the breakfast club with charlamagne.",1
,tara reade is dropped as client by a leading #metoo lawyer,1
,"in contentious interview, biden says black voters considering trump over him ""ain't black""",1
,"biden to charlamagne tha god “i tell you if you have a problem figuring out whether you’re for me or trump, then you ain’t black"" (17:25 or so)",1
,fox news poll: biden opens up 8-point lead over trump,1
,"biden: ‘if you have a problem figuring out whether you’re for me or trump, then you ain’t black’ (translation, do what you're told and vote democrat) wow, so woke and progressive!",1
,"antimalarial drug touted by president trump is linked to increased risk of death in coronavirus patients, study says",1
,divided by covid-19: democratic u.s. areas hit three times as hard as republican ones,1
,"biden: ‘if you have a problem figuring out whether you’re for me or trump, then you ain’t black’",1
,"biden: 'if you have a problem figuring out whether you're for me or trump, then you ain't black'",1
,the case for letting the restaurant industry die,1
[removed],"any thoughts on this ""note"" written by a smart friend? (top law school- knew some big players.) written just for some friends.",1
,trump gripes that fox news is 'doing nothing' to get him reelected,1
,"us president donald trump will lose election by landslide, new model predicts",1
,"michigan ag: donald trump's actions were 'extremely disappointing, and yet totally predictable' - cnn video",1
,donald trump attacks fox news for 'doing nothing to help' get him reelected,1
,"can hydroxychloroquine be put to the tune of ""mississippi queen""? yes, it can!",1
[removed],i like to keep an open mind.,1
,image the president didn't want the press to see,1
,"nancy pelosi: women were not *given* the right to vote. they won it for themselves through sheer force of will. generations of women &amp; girls fought to be heard. today, we honor their leadership as we mark 101 years since the house passed the 19th amendment.",1
[removed],am i republican?,1
,"mike pompeo's home state newspaper calls his ""gaudy, taxpayer-funded dinners"" a gross exploitation of public trust",1
,"michigan ag dana nessel ""michigan may have a president who doesn't care about our state residents, but you have a governor, attorney general and secretary of state who do. elections have consequences. i'm looking at you, november 2020.""",1
"#our man joe will talk with stephen colbert tonight at 11:35 pm on cbs. 

#if that's too late for you, set the dvr to record it now!","don't miss joe biden on ""a late show"" with stephen colbert tonight on cbs!",1
,"discord server, support group, &amp; virtual hangout for trans folks &amp; allies! come quarantine with us &lt;3",1
,the rise and fall of the new deal democrats,1
,"freed by court ruling, republicans step up effort to patrol voting - the new york times",1
[removed],"hear me out, join trumps mailing list",1
,convictions could be challenged as defense attorneys question tara reade’s credentials.,1
,convictions could be challenged as defense attorneys question tara reade’s credentials.,1
,wm88id - cara mendaftar akun w88 | w88,1
,coronavirus vaccine czar to divest some holdings amid conflict concerns,1
,trump says us won't close over second covid-19 wave,1
,trump says he won&amp;#x27;t close the country if second wave,1
,"trump faces 'historic defeat' because of the economy, new election model predicts",1
,trump advisers warn mcsally is in trouble,1
,trump says he won&amp;#x27;t close the country if second wave of coronavirus hits,1
,trump says he won&amp;#x27;t close the country if second wave of coronavirus hits,1
,joe biden answers the web's most searched questions,1
,biden asks klobuchar to undergo vetting for potential running mate role,1
,"protesters hold 'trump lies, people die' signs and dump fake body bags outside white house",1
,"pelosi, schumer ask trump to fly flags at half-staff when us reaches 100,000 coronavirus deaths",1
,"fearing defeat, republicans scramble to manufacture a controversy: an antsy party has decided to use senate committees to effectively make in-kind contributions to trump's re-election campaign",1
,"now is the time that all americans should be wearing the ""make great again"" hat irrespective of their political beliefs. cause it's surely fuck*ked you right now",1
[removed],ruth bader ginsburg has been infected with the coronavirus.,1
,opinion | republicans have a new plan to thwart the will of the people,1
[deleted],trumo against extending unemployment benefits,1
,trump against extending unemployment benefits,1
,daily confirmed coronavirus cases - the 15 nations with more daily cases - from 1 march to 20 may,1
,senate confirms ratcliffe to lead intelligence community under fire,1
,michigan dams fail near midland - not surprising,1
,whoa: dems could take senate from republicans,1
